{
  "id": "lugu",
  "stage": "01-customer-validation",
  "purpose": "统一维护泸古客户资料、验证计划、验证结果和可复现脚本。",
  "status": "active",
  "inputs": [
    "customer-materials/泸古1标架梁工点导入模板.xlsx",
    "validation-plans/泸古项目客户访谈提纲_20260715.md",
    "validation-plans/泸古项目客户验证计划_20260715.md"
  ],
  "entrypoints": [
    "customer-materials/_scripts/build_report.py",
    "customer-materials/_scripts/analyze_bridge_schedule_workbook.py",
    "validation-plans/_scripts/build_validation_workbook.mjs",
    "validation-results/_scripts/compare_plan_versions.py",
    "validation-results/_scripts/build_lugu_project_master.mjs"
  ],
  "results": [
    "customer-materials/泸古项目7月15日上午调研验证记录_20260715.docx",
    "customer-materials/泸古项目7月16日前期工期策划思路分析_20260715.docx",
    "validation-results/plan_version_comparison.json",
    "validation-results/泸古项目计划管理方式变化验证记录_20260716_v3.docx",
    "validation-results/泸古TJ-1标统一工点及桥梁结构物导入数据.xlsx",
    "validation-results/泸古TJ-1标统一主数据_mapping-report.json"
  ],
  "owner": "L01｜需求发现与验证闭环（泸古客户验证）",
  "tracking_policy": "tracked",
  "retention_policy": "批准的客户资料、验证计划、脚本和正式结果跟踪；敏感原文按 local-only 保留；可再生成预览和检查数据进入本地归档。",
  "related_workpackages": []
}
