{
  "id": "json-schedule-review",
  "stage": "01-customer-validation",
  "purpose": "对真实工程排程 JSON 生成检查报告和固定快照。",
  "status": "active",
  "inputs": ["customer-materials/固定资源最小工期结果.v1.json"],
  "entrypoints": [
    "validation-results/_scripts/build-engineering-result-snapshot.mjs",
    "validation-results/_scripts/生成研发结果快照.cmd"
  ],
  "results": [
    "validation-results/固定资源最小工期结果.v1.report.json",
    "validation-results/固定资源最小工期结果.v1.html"
  ],
  "owner": "L01｜需求发现与验证闭环（排程结果验证）",
  "tracking_policy": "tracked",
  "retention_policy": "正式 JSON 输入、报告、HTML 和脚本全部进入 Git；临时预览、缓存和运行日志进入 .local-data。",
  "related_workpackages": ["json-task-viewer"]
}
