{
  "id": "lugu-source-data-analysis",
  "stage": "01-discovery",
  "purpose": "分析泸古来源工作簿结构并产出可复用的数据画像。",
  "status": "active",
  "inputs": ["inputs/泸古1标架梁工点导入模板.xlsx"],
  "entrypoints": ["scripts/analyze_bridge_schedule_workbook.py"],
  "results": ["results/bridge_schedule_structure.json", "results/bridge_progress_profile.json"],
  "owner": "来源数据分析",
  "tracking_policy": "tracked",
  "retention_policy": "批准的来源样例、分析脚本和结构化分析结果保持版本跟踪。",
  "related_workpackages": ["lugu-customer-research", "lugu-validation-material"]
}
