{
  "id": "json-schedule-review",
  "stage": "05-validation",
  "purpose": "对真实工程排程 JSON 生成检查报告和固定快照，隔离客户输入与可再生成结果。",
  "status": "active",
  "inputs": ["input/固定资源最小工期结果.v1.json"],
  "entrypoints": ["scripts/build-engineering-result-snapshot.mjs", "生成研发结果快照.cmd"],
  "results": [
    "output/固定资源最小工期结果.v1.report.json",
    "output/固定资源最小工期结果.v1.html"
  ],
  "owner": "L01｜客户调研与验证闭环（排程结果验证）",
  "tracking_policy": "tracked",
  "retention_policy": "README 和脚本跟踪；真实输入 local-only；报告和 HTML 可再生成并忽略。",
  "related_workpackages": ["json-task-viewer"]
}
