{
  "id": "2026-07-infrastructure-planning-validation-report",
  "stage": "01-customer-validation",
  "purpose": "汇总2026年7月基建策划版本的AI施工策划与多方案比选验证结论。",
  "status": "active",
  "inputs": [],
  "entrypoints": [],
  "results": [
    "validation-results/2026年7月-基建策划版本验证汇报.md"
  ],
  "owner": "L01｜需求发现与验证闭环（2026年7月验证汇报）",
  "tracking_policy": "tracked",
  "retention_policy": "只维护跨项目综合判断；项目事实和原始证据由各项目工作包保存，综合报告仅引用不复制。",
  "related_workpackages": [
    "lugu",
    "dianfengwu-tj08",
    "dianfengwu-tj03"
  ]
}
