{
  "id": "infrastructure-version-2026q2",
  "stage": "01-customer-validation",
  "purpose": "保存基建版本 2026 Q2 历史客户资料及其脱敏迁移索引。",
  "status": "orphaned",
  "inputs": ["customer-materials/"],
  "entrypoints": [],
  "results": ["validation-results/asset-index.md"],
  "owner": "L01｜需求发现与验证闭环（历史客户资料）",
  "tracking_policy": "tracked",
  "retention_policy": "工作包契约和脱敏索引跟踪；含客户信息的 PDF 与来源映射保持 local-only，迁移或替换前核对 SHA-256。",
  "related_workpackages": ["dianfengwu-tj03", "lugu"]
}
